Title,Author,PublishedDate,URL
The Place of UX,Ryan Singer,"April 24, 2019",https://m.signalvnoise.com/the-place-of-ux/
Do I truly want to become a manager?,Claire Lew,"April 23, 2019",https://m.signalvnoise.com/do-i-truly-want-to-become-a-manager/
Unplugged from the Matrix,Wailin Wong,"April 23, 2019",https://m.signalvnoise.com/unplugged-from-the-matrix/
Everybody helps: the evolution of all-hands support,James Glazebrook,"April 22, 2019",https://m.signalvnoise.com/everybody-helps-the-evolution-of-all-hands-support/
The 9 mistakes you don’t know you’re making as a new manager,Claire Lew,"April 16, 2019",https://m.signalvnoise.com/the-9-mistakes-you-dont-know-youre-making-as-a-new-manager/
Work harder or the communists will win!,DHH,"April 16, 2019",https://m.signalvnoise.com/work-harder-or-the-communists-will-win/
Evolving and explaining how we run our company,Jason Fried,"April 12, 2019",https://m.signalvnoise.com/evolving-and-explaining-how-we-run-our-company/
A great ad,Jason Fried,"April 11, 2019",https://m.signalvnoise.com/a-great-ad/
What’s the one thing…,DHH,"April 10, 2019",https://m.signalvnoise.com/whats-the-one-thing/
Subscription Hostages,Wailin Wong,"April 9, 2019",https://m.signalvnoise.com/subscription-hostages/
