Title,Author,PublishedDate,URL
Fighting the ticking clock in your head,Dan Kim,"February 29, 2016",https://m.signalvnoise.com/fighting-the-ticking-clock-in-your-head/
The Majestic Monolith,DHH,"February 29, 2016",https://m.signalvnoise.com/the-majestic-monolith/
Two new email reports in Basecamp,Connor Muirhead,"February 26, 2016",https://m.signalvnoise.com/two-new-email-reports-in-basecamp/
Basecamp 3 for Mac and Windows is here!,Jason Zimdars,"February 26, 2016",https://m.signalvnoise.com/basecamp-3-for-mac-and-windows-is-here/
First principles,Nathan Kontny,"February 25, 2016",https://m.signalvnoise.com/first-principles/
New: Better control over email and phone notifications in Basecamp 3,Ryan Singer,"February 25, 2016",https://m.signalvnoise.com/new-better-control-over-email-and-phone-notifications-in-basecamp-3/
Practical skills that practical data scientists need,Noah Lorang,"February 24, 2016",https://m.signalvnoise.com/practical-skills-that-practical-data-scientists-need/
Remembering how I got here — with a lot of help from others,Dan Kim,"February 18, 2016",https://m.signalvnoise.com/remembering-how-i-got-here-with-a-lot-of-help-from-others/
Data scientists mostly just do arithmetic and that’s a good thing,Noah Lorang,"February 16, 2016",https://m.signalvnoise.com/data-scientists-mostly-just-do-arithmetic-and-thats-a-good-thing/
Bootstrapped and Proud,Wailin Wong,"February 16, 2016",https://m.signalvnoise.com/bootstrapped-and-proud/
