Title,Author,PublishedDate,URL
Respecting privacy at Basecamp,Noah Lorang,"February 28, 2018",https://m.signalvnoise.com/respecting-privacy-at-basecamp/
An Ode to Experimental Design,Jonas Downey,"February 23, 2018",https://m.signalvnoise.com/an-ode-to-experimental-design/
On Writing Software Well,DHH,"February 20, 2018",https://m.signalvnoise.com/on-writing-software-well/
Meetings are Toxic,Wailin Wong,"February 20, 2018",https://m.signalvnoise.com/meetings-are-toxic/
Conflicts are rarely just about the cards on the table,DHH,"February 12, 2018",https://m.signalvnoise.com/conflicts-are-rarely-just-about-the-cards-on-the-table/
New in Basecamp: Improved Schedule Cards,Scott Upton,"February 12, 2018",https://m.signalvnoise.com/new-in-basecamp-improved-schedule-cards/
Cultivating an Inclusive Culture,jpburch,"February 12, 2018",https://m.signalvnoise.com/cultivating-an-inclusive-culture/
Social Support,Nathan Kontny,"February 7, 2018",https://m.signalvnoise.com/social-support/
Interruption is Not Collaboration,Wailin Wong,"February 6, 2018",https://m.signalvnoise.com/interruption-is-not-collaboration/
"The world needs more modest, linear growth companies. Please make some.",DHH,"February 5, 2018",https://m.signalvnoise.com/the-world-needs-more-modest-linear-growth-companies-please-make-some/
