Title,Author,PublishedDate,URL
Remote work is a platform,Jason Fried,"July 24, 2020",https://m.signalvnoise.com/remote-work-is-a-platform/
Take a video tour of HEY,Jason Fried,"July 21, 2020",https://m.signalvnoise.com/take-a-video-tour-of-hey/
"Spy pixels are evolving like malware, so HEY’s adapting",DHH,"July 17, 2020",https://m.signalvnoise.com/spy-pixels-are-evolving-like-malware-so-heys-adapting/
On Apple’s monopoly power to destroy HEY,DHH,"July 17, 2020",https://m.signalvnoise.com/on-apples-monopoly-power-to-destroy-hey/
Basecamp’s Ops Team is Hiring,Andrea Larowe,"July 17, 2020",https://m.signalvnoise.com/basecamps-ops-team-is-hiring/
How we achieve “simple design” for Basecamp and HEY,Jonas Downey,"July 8, 2020",https://m.signalvnoise.com/how-we-achieve-simple-design-for-basecamp-and-hey/
