Title,Author,PublishedDate,URL
Don’t solve the problem.,Claire Lew,"March 26, 2019",https://m.signalvnoise.com/dont-solve-the-problem/
Did You Order the Code Red?,Shaun Hildner,"March 26, 2019",https://m.signalvnoise.com/did-you-order-the-code-red/
"Basecamp outage: When it rains, it pours",DHH,"March 12, 2019",https://m.signalvnoise.com/basecamp-outage-when-it-rains-it-pours/
The 3 most effective ways to build trust as a leader,Claire Lew,"March 12, 2019",https://m.signalvnoise.com/the-3-most-effective-ways-to-build-trust-as-a-leader/
Hiring Is Not Hazing,Wailin Wong,"March 12, 2019",https://m.signalvnoise.com/hiring-is-not-hazing/
Basecamp 2 and Basecamp 3 search outage report,DHH,"March 7, 2019",https://m.signalvnoise.com/basecamp-2-and-basecamp-3-search-outage-report/
"Design lesson: Consistency, confusion, and context",Jason Fried,"March 5, 2019",https://m.signalvnoise.com/design-lesson-consistency-confusion-and-context/
"Delegate outcomes, not activities.",Claire Lew,"March 4, 2019",https://m.signalvnoise.com/delegate-outcomes-not-activities/
