Title,Author,PublishedDate,URL
What’s the difference between time and attention? A lot.,Jason Fried,"November 30, 2015",https://m.signalvnoise.com/whats-the-difference-between-time-and-attention-a-lot/
The first batch of Basecamp 3 updates,Jason Fried,"November 30, 2015",https://m.signalvnoise.com/the-first-batch-of-basecamp-3-updates/
The day I became a millionaire,DHH,"November 25, 2015",https://m.signalvnoise.com/the-day-i-became-a-millionaire/
Connecting the dots: How my opinion made it into the New York Times,Jason Fried,"November 24, 2015",https://m.signalvnoise.com/connecting-the-dots-how-my-opinion-made-it-into-the-new-york-times/
I don’t want to be a winner,DHH,"November 12, 2015",https://m.signalvnoise.com/i-dont-want-to-be-a-winner/
Small is not a stepping stone,DHH,"November 11, 2015",https://m.signalvnoise.com/small-is-not-a-stepping-stone/
"Osmo Wiio: Communication usually fails, except by accident",Jason Fried,"November 9, 2015",https://m.signalvnoise.com/osmo-wiio-communication-usually-fails-except-by-accident/
Basecamp 3 is here!,Jason Fried,"November 4, 2015",https://m.signalvnoise.com/basecamp-3-is-here/
RECONSIDER,DHH,"November 4, 2015",https://m.signalvnoise.com/reconsider/
