Title,Author,PublishedDate,URL
Hosting a YouTube Channel,Nathan Kontny,"November 30, 2016",https://m.signalvnoise.com/hosting-a-youtube-channel/
From Inbox Zero to Inbox Comes Second,kristinaards,"November 29, 2016",https://m.signalvnoise.com/from-inbox-zero-to-inbox-comes-second/
How We Work — The Support Team,Chase Clemons,"November 28, 2016",https://m.signalvnoise.com/how-we-work-the-support-team/
Of course Zuckerberg wants to bow to Chinese censorship,DHH,"November 24, 2016",https://m.signalvnoise.com/of-course-zuckerberg-wants-to-bow-to-chinese-censorship/
Basecamp 3 just got a whole lot… simpler,Jason Zimdars,"November 23, 2016",https://m.signalvnoise.com/basecamp-3-just-got-a-whole-lot-simpler/
“I’m not sure if I like what I did here or not”,Jason Fried,"November 22, 2016",https://m.signalvnoise.com/im-not-sure-if-i-like-what-i-did-here-or-not/
Test of Metal,Wailin Wong,"November 22, 2016",https://m.signalvnoise.com/test-of-metal/
Microsoft reboots war on sleep,DHH,"November 22, 2016",https://m.signalvnoise.com/microsoft-reboots-war-on-sleep/
How we structure our work and teams at Basecamp,Jason Fried,"November 17, 2016",https://m.signalvnoise.com/how-we-structure-our-work-and-teams-at-basecamp/
"Apps to make movies, workflow, and music for YouTube videos",Nathan Kontny,"November 14, 2016",https://m.signalvnoise.com/apps-to-make-movies-workflow-and-music-for-youtube-videos/
