Title,Author,PublishedDate,URL
What would it take to prove me wrong?,DHH,"October 30, 2015",https://m.signalvnoise.com/what-would-it-take-to-prove-me-wrong/
Why I stopped paying attention to industry news,Jason Fried,"October 27, 2015",https://m.signalvnoise.com/why-i-stopped-paying-attention-to-industry-news/
"Remove the stress, pick a deadline",DHH,"October 19, 2015",https://m.signalvnoise.com/remove-the-stress-pick-a-deadline/
"Poaching is for animals, not employees",DHH,"October 14, 2015",https://m.signalvnoise.com/poaching-is-for-animals-not-employees/
Making money takes practice like playing the piano takes practice,Jason Fried,"October 7, 2015",https://m.signalvnoise.com/making-money-takes-practice-like-playing-the-piano-takes-practice/
There’s always time to launch your dream,DHH,"October 6, 2015",https://m.signalvnoise.com/theres-always-time-to-launch-your-dream/
Don’t base your business on a paid app,DHH,"October 5, 2015",https://m.signalvnoise.com/dont-base-your-business-on-a-paid-app/
