Title,Author,PublishedDate,URL
The immeasurable value of customer friendly policies,Dan Kim,"September 28, 2018",https://m.signalvnoise.com/the-immeasurable-value-of-customer-friendly-policies/
You know what’s cool? Turning down twenty billion dollars,DHH,"September 27, 2018",https://m.signalvnoise.com/you-know-whats-cool-turning-down-twenty-billion-dollars/
Illustrating “It Doesn’t Have to Be Crazy at Work”,Jason Zimdars,"September 26, 2018",https://m.signalvnoise.com/illustrating-it-doesnt-have-to-be-crazy-at-work/
"Farewell, Noah",Wailin Wong,"September 25, 2018",https://m.signalvnoise.com/farewell-noah/
Basecamp is hiring a data analyst,DHH,"September 21, 2018",https://m.signalvnoise.com/basecamp-is-hiring-a-data-analyst/
How You’re Being Manipulated By Software,Jonas Downey,"September 17, 2018",https://m.signalvnoise.com/how-youre-being-manipulated-by-software/
The Rework Podcast is back!,Wailin Wong,"September 12, 2018",https://m.signalvnoise.com/the-rework-podcast-is-back/
In-store good vs. At-home good,Jason Fried,"September 10, 2018",https://m.signalvnoise.com/in-store-good-vs-at-home-good/
Basecamp 3: New feature round-up,Jason Zimdars,"September 7, 2018",https://m.signalvnoise.com/basecamp-3-new-feature-round-up/
The future of the Android community is YOU,Dan Kim,"September 7, 2018",https://m.signalvnoise.com/the-future-of-the-android-community-is-you/
