Title,Author,PublishedDate,URL
What living and working from a hotel for 3 weeks has taught me,Natalie Keshlear,"September 29, 2016",https://m.signalvnoise.com/what-living-and-working-from-a-hotel-for-3-weeks-has-taught-me/
Show Up: Mind The Work,Mercedes de Luca,"September 28, 2016",https://m.signalvnoise.com/show-up-mind-the-work/
Empowering the Next Generation,Allison Groves,"September 27, 2016",https://m.signalvnoise.com/empowering-the-next-generation/
How shaking off the feeling of embarrassment helped this entrepreneur compete against a…,Nathan Kontny,"September 27, 2016",https://m.signalvnoise.com/how-shaking-off-the-feeling-of-embarrassment-helped-this-entrepreneur-compete-against-a/
The house that Russell built,Wailin Wong,"September 27, 2016",https://m.signalvnoise.com/the-house-that-russell-built/
New in Basecamp 3: Chatbots!,DHH,"September 26, 2016",https://m.signalvnoise.com/new-in-basecamp-3-chatbots/
It’s always your fault,DHH,"September 23, 2016",https://m.signalvnoise.com/its-always-your-fault/
Getting stuff done in 2016,Nathan Kontny,"September 22, 2016",https://m.signalvnoise.com/getting-stuff-done-in-2016/
New in Basecamp 3: Campfire @mentions,Javan Makhmali,"September 21, 2016",https://m.signalvnoise.com/new-in-basecamp-3-campfire-mentions/
Advice to a younger me,Nathan Kontny,"September 21, 2016",https://m.signalvnoise.com/advice-to-a-younger-me/
